事件一年内频率,事件历史悠久程度,地点,开始日期,是否会议,是否体育赛事,是否天气,是否展会,是否影响商务人群,是否影响社会大众,是否是否是国内民间协会,是否是国内行业协会,是否是国家政府,是否是国际性组织,是否是国际民间协会,是否是国际行业协会,是否是地方级政府,是否是省政府,是否有固定的参与人群,是否演唱会,标题,结束日期
1,1,北京国家会议中心,日前,1,0,0,0,0,1,0,0,0,0,0,0,0,0,0,0,2017-09-05本网讯（记者李淼实习生段茜）,日前
1,1,null,昨日,1,0,0,0,0,1,0,0,0,0,0,0,0,0,0,0,2017中国机器人产业创新峰会,昨日
1,1,南京,9月18-19日,1,0,0,0,0,1,0,0,0,0,0,0,0,0,0,0,我国服务机器人领域规模最大、规格最高的专业峰会“第三届国际服务机器人产业高峰论坛,9月18-19日
1,1,null,2017/09/05,1,0,0,0,0,1,0,0,0,0,0,0,0,0,0,0,金砖峰会,2017/09/05
1,1,广州,2017年8月30日,1,0,0,0,0,1,0,0,0,0,0,0,0,0,0,0,广东省经济和信息化委员会,2017年8月30日
